REG_ANS,CNPJ,RAZAO_SOCIAL,NOME_FANTASIA,MODALIDADE,LOGRADOURO,NUMERO,COMPLEMENTO,BAIRRO,CIDADE,UF,CEP,DDD,TELEFONE,FAX,EMAIL,REPRESENTANTE,CARGO_REPRESENTANTE,REGIAO_DE_COMERCIALIZACAO,DATA_REGISTRO_ANS,DATA_DESCREDENCIAMENTO,MOTIVO_DO_DESCREDENCIAMENTO,DATA_PROCESSAMENTO
323632,1564858000141,UNIODONTO COOPERATIVA TRABALHO ODONTOLOGICO DE PARA DE MINAS,UNIODONTO PARA DE MINAS,Cooperativa Odontológica,RUA MAJOR FIDELIS,150,,CENTRO,Pará de Minas,MG,35660109.0,3,732321522,732321522,uniodonto@parademinas.com.br,HENRIQUE MARCOS FERREIRA,DIRETOR PRESIDENTE,5.0,,,Alternat. à Liquidação - Deliberação de Diretoria Colegiada,2025-10-20 17:16:59.558180
320935,21742853000179,UNIODONTO BH- COOPERATIVA DE TRABALHO ODONTOLOGICO LTDA,UNIODONTO-BH,Cooperativa Odontológica,AV. FRANCISCO SALES,1463,3º ANDAR,BAIRRO DOS FUNCIONÁRIOS,Belo Horizonte,MG,30150221.0,31,2416222,,uniodonto.bh@uniodontobh.org.br,JOSÉ DANIEL FERREIRA GOMES,,,,,Pedido de cancelamento,2025-10-20 17:16:59.558180
344583,1182248000183,FEDERAÇÃO DAS UNIODONTOS DO ESTADO DE MINAS GERAIS,UNIODONTO MG,Cooperativa Odontológica,AVENIDA FRANCISCO SALES,1463,4º ANDAR - SALA 401,SANTA EFIGÊNIA,Belo Horizonte,MG,30150221.0,31,32415521,,uniodontomg@uniodontomg.com.br,RICARDO MANOEL LOURENÇO,PRESIDENTE,4.0,,,Pedido de cancelamento,2025-10-20 17:16:59.558180
318710,1422960000102,UNIODONTO DE VESPASIANO PARQUE CIMENTEIRO COOPERATIVA DE TRABALH,UNIODONTO DE VESPASIANO  PARQUE CIMENTEIRO,Cooperativa Odontológica,RUA NOSSA SENHORA DE LOURDES,273,,CENTRO,Vespasiano,MG,33200000.0,31,6210166,6212042,edson@fiemg.com.br,SCYOMARA SALOMÃO CARVALHO ARAÚJO,,,,,Pedido de cancelamento,2025-10-20 17:16:59.558180
356085,2220089000127,UNIODONTO VALE DO AÇO COOPERATIVA ODONTOLOGICA,UNIODONTO VALE DO AÇO,Cooperativa Odontológica,AV. CASTELO BRANCO,610,SALA 303,HORTO,Ipatinga,MG,35160294.0,31,38231379,38231379,uniodontovaledoaco@hotmail.com,GERALDO MAJELA REZENDE,DIRETOR PRESIDENTE,5.0,,,Pedido de cancelamento,2025-10-20 17:16:59.558180
400262,1969947000178,UNIODONTO DE ITABIRA COOPERATIVA ODONTOLOGICA LTDA,,Cooperativa Odontológica,RUA SÃO JOSÉ,201,LOJA B,CENTRO,Itabira,MG,35900003.0,31,8313065,,,,,,,,Pedido de cancelamento,2025-10-20 17:16:59.558180
381357,1577427000110,UNIODONTO COOPERATIVA DE TRABALHOS ODONTOLÓGICOS LTDA,UNIODONTO COOP TRAB ODONTOLÓGICOS,Cooperativa Odontológica,RUA FERNÃO DIAS,271,SALA 207,CARNEIRINHOS,João Monlevade,MG,35930000.0,31,38515611,38515611,conexcel@robynet.com.br,JOSÉ CARLOS DE ABREU,PRESIDENTE,,,,Pedido de cancelamento,2025-10-20 17:16:59.558180
339440,1851408000130,COOPERATIVA DE TRABALHO ODONTOLOGICA LTDA,UNIODONTO VIÇOSA,Cooperativa Odontológica,RUA VEREADOR JOSE VALENTINO DA CRUZ,30,,CENTRO,Viçosa,MG,36570000.0,31,38912557,38919348,uniodonto@buynet.com.br,CERES HAELE ARNAUT,DIRETORA PRESIDENTE,6.0,,,Descumprimento da RN n.º 100/2005,2025-10-20 17:16:59.558180
324027,1478517000153,UNIODONTO DE BARBACENA-COOP.DE TRAB.ODONTOLOGICO LTDA,UNIODONTO DE BARBACENA,Cooperativa Odontológica,AV. BIAS FORTES,895,,CENTRO,Barbacena,MG,36200000.0,32,3317022,3317022,,MARIO WILSON BECHO CAMPOS,PRESIDENTE,,,,Pedido de cancelamento,2025-10-20 17:16:59.558180
352039,2077558000109,UNIODONTO DE SÃO JOÃO DEL REI MINAS GERAIS,UNIODONTO DE SÃO JOÃO DEL REI,Cooperativa Odontológica,Av. Tiradentes,469,sala 02,CENTRO,São João del Rei,MG,36307346.0,32,33718402,33718402,uniodonto@mgconecta.com.br,RAMIRO CAMPANHA BOTELHO,PRESIDENTE,,,,Pedido de cancelamento,2025-10-20 17:16:59.558180
319635,1631658000164,UNIODONTO UBA COOPERATIVA DE TRABALHO ODONTOLOGICO LTDA,UNIODONTO UBA,Cooperativa Odontológica,AVENIDA RAUL SOARES,36,LOJA 09,CENTRO,Ubá,MG,36500000.0,32,35314695,,cd.adriana@yahoo.com.br,ADRIANA NASCIMENTO VASCONCELLOS,LIQUIDANTE,6.0,,,Pedido de cancelamento,2025-10-20 17:16:59.558180
401919,2021621000187,UNIODONTO LEOPOLDINA - COOPERATIVA ODONTOLÓGICA,,Cooperativa Odontológica,RUA JOSÉ PERES,46,LOJA 01,CENTRO,Leopoldina,MG,36700000.0,32,34415754,34415754,uniodonto@leopoldina.com.br,MARCELO RESENDE VIEIRA,PRESIDENTE,5.0,,,Alternat. à Liquidação - Deliberação de Diretoria Colegiada,2025-10-20 17:16:59.558180
410284,3002578000175,COOPERATIVA  DE TRABALHO ODONTOLÓGICO  LTDA,UNIODONTO CATAGUASES,Cooperativa Odontológica,RUA DR SOBRAL,268,SALA 02,CENTRO,Cataguases,MG,36770044.0,32,34213615,34222089,uneodont@net.em.com.br,JOSE PAULO VIEIRA DE ALMEIDA,DIRETOR PRESIDENTE,6.0,,,Pedido de cancelamento,2025-10-20 17:16:59.558180
327441,1290793000193,UNIODONTO SUDESTE MINEIRO COOPERATIVA DE SAÚDE ODONTOLÓGICA LTDA,UNIODONTO SUDESTE MINEIRO,Cooperativa Odontológica,RUA OSCAR VIDAL,373,,CENTRO,Juiz de Fora,MG,36016290.0,32.0,32150706.0,32151561.0,uniodonto@uniodontojf.com.br,MAGALI DE FREITAS MACIEL,DIRETORA PRESIDENTE,5.0,,,,2025-10-20 17:16:59.558180
353515,1227823000117,UNIODONTO GOVERNADOR VALADARES COOP. TRAB. ODONTOLÓGICO LTDA,UNIODONTO GV,Cooperativa Odontológica,RUA BARBARA HELIODORA,399,SALA 111/112,CENTRO,Governador Valadares,MG,35010040.0,33,32717712,32174454,uniodonto@goval.com.br,BOGUMILA K. I. PERIM,DIRETORA PRESIDENTE,6.0,,,Descumprimento da RN n.º 100/2005,2025-10-20 17:16:59.558180
402460,68544527000110,UNIODONTO DE TEOFILO OTONI COOP. DE TRAB. ODONTOLOGICO LTDA,UNIODONTO DE TEOFILO OTONI,Cooperativa Odontológica,"RUA ANTONIO ALVES BENJAMIN, 49",,,CENTRO,Teófilo Otoni,MG,39800000.0,33,35226601,5226601,unicoope@uai.com.br,JOSÉ ANTÔNIO CARVALHO SOARES,DIRETOR FINANCEIRO,,,,Pedido de cancelamento,2025-10-20 17:16:59.558180
410721,3396905000110,UNIODONTO PONTAL DO TRIANGULO COOP. DE TRAB. ODONTOLOGICO,UNIODONTO PONTAL DO TRIANGULO,Cooperativa Odontológica,RUA FRUTAL,916,,CENTRO,Iturama,MG,38280000.0,34,34114345,344113492,uniodontopontal@enetec.com.br,ROGERIO ROBERTO BARBOSA RIBEIRO,PRESIDENTE,,,,Pedido de cancelamento,2025-10-20 17:16:59.558180
35845,68529007000139,FEDERAÇAO DA UNIODONTO DA REGIAO CENTRAL DO BRASIL,UNICENTRO,Cooperativa Odontológica,RUA CEL. SEVERIANO,960,,TABAJÁRAS,Uberlândia,MG,38400000.0,34,2361775,2368071,uniodont@triang.com.br,DR. FAUSTO LOURENÇO DA COSTA,,,,,Pedido de cancelamento,2025-10-20 17:16:59.558180
30998,64366099000122,UNIODONTO ARAGUARI COOPERATIVA DE TRABALHO ODONTOLOGICO LTDA,UNIODONTO ARAGUARI,Cooperativa Odontológica,R. QUINCA MARIANO,212,,CENTRO,Araguari,MG,38440000.0,34,2410860,2410860,,,,,,,Descumprimento da Circular SUSEP no. 77/1999,2025-10-20 17:16:59.558180
33411,65371759000126,UNIODONTO PATOS DE MINAS COOPERATIVA DE TRABALHO ODONTOLOGICO LT,UNIODONTO PATOS DE MINAS,Cooperativa Odontológica,R. AGENOR MACIEL,170,S/ 402 E 403,CENTRO,Patos de Minas,MG,38700000.0,34,8215879,8215879,,,,,,,Descumprimento da Circular SUSEP no. 77/1999,2025-10-20 17:16:59.558180
344907,71246482000102,UNIODONTO PATROCINIO COOPERATIVA DE TRABALHO ODONTOLOGICO LTDA.,UNIODONTO PATROCÍNIO,Cooperativa Odontológica,RUA CORONEL RABELO,1231,,,Patrocínio,MG,38740000.0,34,38316055,38316055,,OSCAR CARLOS DA SILVA,PRESIDENTE,,,,Pedido de cancelamento,2025-10-20 17:16:59.558180
370568,17333055000116,UNIODONTO UBERABA - COOPERATIVA DE ASSISTÊNCIA À SAÚDE ODONTOLÓGICA LTDA,UNIODONTO,Cooperativa Odontológica,RUA CORONEL MANOEL BORGES,618,,CENTRO,Uberaba,MG,38060340.0,34.0,33347700.0,,gerencia@uniodontouberaba.com.br,WASHINGTON TADEU NASCIMENTO,DIRETOR EXECUTIVO,5.0,,,,2025-10-20 17:16:59.558180
344451,26185199000163,UNIODONTO REGIONAL COOPERATIVA ODONTOLOGICA,UNIODONTO MINAS,Cooperativa Odontológica,AV JOÃO XXIII,697,,SANTA MARIA,Uberlândia,MG,38408056.0,34.0,32288118.0,,gerencia@uniodontouberlandia.com.br,RICARDO MANOEL LOURENÇO,PRESIDENTE,5.0,,,,2025-10-20 17:16:59.558180
33150,1568873000168,UNIODONTO SUL DE MINAS COOPERATIVA TRABALHO ODONTOLOGICO LTDA.,UNIODONTO SUL DE MINAS,Cooperativa Odontológica,R. SANTA CRUZ,385,,CENTRO,Varginha,MG,37002090.0,35,2228333,2228333,,,,,,,Descumprimento da Circular SUSEP no. 77/1999,2025-10-20 17:16:59.558180
358380,1792938000154,UNIODONTO TRES PONTAS - COOPERATIVA DE TRABALHO OTONDOLOGICO LTD,UNIODONTO TRES PONTAS,Cooperativa Odontológica,RUA AMERICO MIARI,22,SALAS 03 E 10,CENTRO,Três Pontas,MG,37190000.0,35,32651771,32651771,allinfo@net.em.com.br,SOLANGE XIMENES ABREU,PRESIDENTE,,,,Pedido de cancelamento,2025-10-20 17:16:59.558180
300292,1561038000104,UNIODONTO DE LAVRAS COOPERATIVA DE TRABALHO ODONTOLÓGICO,UNIODONTO LAVRAS,Cooperativa Odontológica,RUA COSTA PEREIRA,26,SALA 06,CENTRO,Lavras,MG,37200000.0,35,32222773,,f.campos@vga.matrix.com.br,PAULO HENRIQUE SILVA RAIMUNDO,PRESIDENTE,,,,Pedido de cancelamento,2025-10-20 17:16:59.558180
342815,2463102000179,UNIODONTO VALE DO RIO VERDE TRÊS CORAÇÕES COOPERATIVA ODONTOLOGICA,UNIODONTO TRÊS CORAÇÕES,Cooperativa Odontológica,RUA PEDRO BONESIO,225,"SALA  "" E "", EDIFÍCIO JULIANA",CENTRO,Três Corações,MG,37410000.0,35,32324147,32324147,uniodonto@unincor.br,SIMONE CERQUEIRA FERREIRA,PRESIDENTE,6.0,,,Pedido de cancelamento,2025-10-20 17:16:59.558180
355011,2246412000131,UNIODONTO CIRCUITO DAS ÁGUAS COOPERATIVA ODONTOLÓGICA LTDA,UNIODONTO,Cooperativa Odontológica,RUA CORONEL JOSE JUSTINO,459,SALA 101,CENTRO,São Lourenço,MG,37470000.0,35,33322727,33322727,uniodontoca@uol.com.br,RICARDO LUIS GANHAM DE CASTRO,DIRETOR FINANCEIRO,5.0,,,Descumprimento de disposição legal,2025-10-20 17:16:59.558180
307050,25906728000108,COOPERATIVA DE TRABALHO ODONTOLOGICO UNIODONTO ITAJUBA,UNIODONTO ITAJUBÁ,Cooperativa Odontológica,RUA MAJOR BELO LISBOA,22,SALA 72,CENTRO,Itajubá,MG,37500000.0,35,6220258,6220258,,,,,,,Pedido de cancelamento,2025-10-20 17:16:59.558180
351768,1877526000117,UNIODONTO POUSO ALEGRE COOPERATIVA DE TRABALHO ODONTOLOGICO LTDA,UNIODONTO POUSO ALEGRE,Cooperativa Odontológica,AVENIDA DR. JOÃO BERALDO,408,,CENTRO,Poços de Caldas,MG,37550000.0,35,4229674,4229674,,EVERTON RENÓ CORRÊA,,,,,Pedido de cancelamento,2025-10-20 17:16:59.558180
340715,2768410000102,UNIODONTO DE PASSOS COOPERATIVA ODONTOLOGICA,UNIODONTO PASSOS,Cooperativa Odontológica,R. EUVIRA SILVEIRA COIMBRA,,139,CENTRO,Passos,MG,37900000.0,35,5211370,,,,,,,,Pedido de cancelamento,2025-10-20 17:16:59.558180
419028,25906728000108,COOPERATIVA DE TRABALHO ODONTOLOGICO - UNIODONTO ITAJUBÁ,,Cooperativa Odontológica,RUA ALCIDES FARIA,240,,VARGINHA,Itajubá,MG,37501058.0,35.0,36220258.0,36220258.0,uniodonto@uniodontoitajuba.com.br,ALEXANDRE JULIO DIELLE,DIRETOR PRESIDENTE,5.0,,,,2025-10-20 17:16:59.558180
409791,3494031000134,COOPERATIVA ODONTOLÓGICA POÇOS DE CALDAS,UNIODONTO POÇOS DE CALDAS,Cooperativa Odontológica,RUA PARAIBA,212,,CENTRO,Poços de Caldas,MG,37701726.0,35.0,37167222.0,37167222.0,ouvidoria@uniodontopocos.com.br,FERNANDO DE PAIVA POSSO,PRESIDENTE,5.0,,,,2025-10-20 17:16:59.558180
419729,2768410000102,UNIODONTO PASSOS - COOPERATIVA ODONTOLÓGICA,UNIODONTO PASSOS,Cooperativa Odontológica,RUA BONSUCESSO,472,,SÃO FRANCISCO,Passos,MG,37902000.0,35.0,35213567.0,,uniodontopassos@passosnet.com.br,LUIZ FERNANDO LEMOS REIS,DIRETOR PRESIDENTE,5.0,,,,2025-10-20 17:16:59.558180
386715,1412387000156,UNIODONTO SAO FRANCISCO COOPERATIVA DE TRABALHO ODONTOLOGICO LTD,UNIODONTO SAO FRANCISCO,Cooperativa Odontológica,RUA MATO GROSSO,397-A,,CENTRO,Pirapora,MG,39270000.0,38,7411707,7411707,paulino@interpira.com.br,,,,,,Pedido de cancelamento,2025-10-20 17:16:59.558180
378844,65387938000151,UNIODONTO COOP. DE TRAB. ODONTOLOGICOS NORTE DE MINAS,UNIODONTO NORTE DE MINAS,Cooperativa Odontológica,RUA SAO FRANCISCO,390,502,CENTRO,Montes Claros,MG,39400048.0,38,2212323,2212323,,EDUARDO BRANDAO LIMA,PRESIDENTE,,,,Pedido de cancelamento,2025-10-20 17:16:59.558180
410080,72510472000103,UNIODONTO PARANÁ FED EST. COOP ODONTOLOGICAS,UNIODONTO PARANÁ,Cooperativa Odontológica,RUA VISCONDE DE NACAR,1505,6º ANDAR,CENTRO,Curitiba,PR,80410201.0,41,2337060,2337060,,,,,,,Pedido de cancelamento,2025-10-20 17:16:59.558180
316768,2295221000160,UNIODONTO DE CORNÉLIO PROCÓPIO - COOPERATIVA ODONTOLOGICA,UNIODONTO DE CORNÉLIO PROCÓPIO - COOPERATIVA ODONTOLÓGICA,Cooperativa Odontológica,RUA PARAIBA,278,,CENTRO,Cornélio Procópio,PR,86300000.0,43,5231964,5231964,uniodonto.cp@onda.com.br,JOSÉ GILBERTO BENASSI,PRESIDENTE,,,,Pedido de cancelamento,2025-10-20 17:16:59.558180
409731,2991429000113,COOPERATIVA DE SERVIÇOS ODONTOLOGICOS UNIODONTO APUCARANA,UNIODONTO APUCARANA,Cooperativa Odontológica,RUA MIGUEL SIMIÃO,365,SALA 6,CENTRO,Apucarana,PR,86800260.0,43,4232568,4232568,,CARLOS ALBERTO FERNANDES DA SILVA,PRESIDENTE,,,,Pedido de cancelamento,2025-10-20 17:16:59.558180
350770,82239476000144,UNIODONTO DE LONDRINA COOP. ODONTOLÓGICA,UNIODONTO DE LONDRINA COOP. ODONTOLÓGICA,Cooperativa Odontológica,RUA PAES LEME,956,,JARDIM AMERICA,Londrina,PR,86010610.0,43.0,33057000.0,33057000.0,claudio@uniodontolondrina.coop.br,MARCELO FANECO FONTANA,DIRETOR PRESIDENTE,5.0,,,,2025-10-20 17:16:59.558180
309958,2681095000181,COOPERATIVA DE SERV. ODONT. DE UMUARAMA - UNIODONTO,UNIODONTO DE UMUARAMA,Cooperativa Odontológica,RUA DESEMBARGADOR  LAURO LOPES,3663,SALA 01,CENTRO,Umuarama,PR,87501210.0,44,6232013,6232013,uniodonto@adsturbo.com,APARECIDO RAVAZZI,DIRETOR PRESIDENTE,5.0,,,Pedido de cancelamento,2025-10-20 17:16:59.558180
363120,2272779000120,UNIODONTO DE PARANAVAI - COOPERATIVA ODONTOLOGICA,UNIODONTO DE PARANAVAI,Cooperativa Odontológica,RUA MINAS GERAIS,386,2. ANDAR,CENTRO,Paranavaí,PR,87701070.0,44,3423.5599,3423.5599,uniodontopvai@uol.com.br,JOSELI RODRIGUES,PRESIDENTE,,,,Descumprimento da RN n.º 100/2005,2025-10-20 17:16:59.558180
381144,1367538000100,UNIODONTO MARINGA COOPERATIVA ODONTOLOGICA,UNIODONTO DE MARINGA,Cooperativa Odontológica,AVENIDA PAPA JOAO XXIII,513,,ZONA 02,Maringá,PR,87010060.0,44.0,32271150.0,,uniodonto@uniodontomaringa.com.br,VAMPRÉ LUIZ CARDOSO OLIVEIRA,DIRETOR PRESIDENTE,5.0,,,,2025-10-20 17:16:59.558180
321109,1931354000112,UNIODONTO DE CASCAVEL - COOPERATIVA ODONTOLÓGICA,UNIODONTO DE CASCAVEL,Cooperativa Odontológica,RUA SANTA CATARINA,769,TERREO,CENTRO,Cascavel,PR,85806040.0,45,32253225,2235188,goesctb@certto.com.br,ELISEU AUGUSTO SICOLI,RESPONSAVEL TECNICO,6.0,,,Pedido de cancelamento,2025-10-20 17:16:59.558180
324451,2250511000197,UNIODONTO DE FOZ DO IGUACU COOPERATIVA ODONTOLOGICA,UNIODONTO FOZ DO IGUACU,Cooperativa Odontológica,RUA MARECHAL FLORIANO PEIXOTO,1386,,CENTRO,Foz do Iguaçu,PR,85851020.0,45,3523772,35237728,uniodonto@zipfoz.com.br,ADELINO COLETTO,DIRETOR PRESIDENTE,6.0,,,Pedido de cancelamento,2025-10-20 17:16:59.558180
318671,61273000146,SOC COOP DE TRAB ODONTOL DE TOLEDO PR LTDA,UNIODONTO DE TOLEDO,Cooperativa Odontológica,RUA 7 DE SETEMBRO,1190,,CENTRO,Toledo,PR,85900220.0,45,2770100,2770100,uniodontoledo@certto.com.br,SCYLLAS ROBERTO MACEDO CAMPOS,PRESIDENTE,,,,Pedido de cancelamento,2025-10-20 17:16:59.558180
301086,2898015000144,UNIODONTO PATO BRANCO COOPERATIVA DE TRABALHO ODONTOLOGICO,UNIODONTO PATO BRANCO COOP. DE TRAB. ODONTOLÓGICO,Cooperativa Odontológica,RUA ITABIRA,1420,SALA 2,CENTRO,Pato Branco,PR,85501290.0,46,2255755,2255755,osnipaul@hotmail.com,LUIS CESAR BURGARDT,DIRETOR LIQUIDANTE,5.0,,,Pedido de cancelamento,2025-10-20 17:16:59.558180
342203,2338268000163,UNIODONTO DE SC COOPERATIVA ADMINISTRADORA DE CONTRATOS,UNIODONTO ADMINISTRADORA,Cooperativa Odontológica,RUA VITÓRIA,123,CASA,CENTRO,Blumenau,SC,89010250.0,47.0,30378000.0,30378000.0,cpd@uniodontosc.com.br,RUBENS RENATO WEIDGENANT,PRESIDENTE,5.0,,,,2025-10-20 17:16:59.558180
415626,7270625000112,FEDERAÇÃO DAS COOP ODONTOLÓGICAS DO ESTADO DE SANTA CATARINA,UNIODONTO CATARINENSE,Cooperativa Odontológica,RUA JOAO PESSOA,10,CASA,VELHA,Blumenau,SC,89036000.0,47.0,30418070.0,30418070.0,cpd@uniodontosc.com.br,MARCOS ADOLF PRINZ,Presidente,5.0,,,,2025-10-20 17:16:59.558180
373907,2785337000187,COOPERATIVA DE ODONTOLOGOS DE SUL CATARINENSE,UNIODONTO SUL,Cooperativa Odontológica,AV CENTENARIO,3673,,CENTRO,Criciúma,SC,88801971.0,48,34377462,34426130,faturamento@uniodontosul.com.br,LUIZ MORONA SOBRINHO,PRESIDENTE,5.0,,,Descumprimento da RN n.º 100/2005,2025-10-20 17:16:59.558180
349925,2586619000155,COOPERATIVA DOS CIRURGIÕES DENTISTAS DA REGIÃO OESTE CATARIN,UNIODONTO OESTE CATARINENSE,Cooperativa Odontológica,Rua Nereu Ramos,75,D SALA 203-B,CENTRO,Chapecó,SC,89807150.0,49,3236250,3231069,marfiorini@bol.com.br,MARCELO FIORINI,PRESIDENTE,,,,Pedido de cancelamento,2025-10-20 17:16:59.558180
353752,87303772000180,UNIODONTO COOP ODONT VALE TAQUARI E RIO PARDO LTDA,UNIODONTO COOP ODONT VALE TAQUARI E RIO PARDO LTDA,Cooperativa Odontológica,AV. JÚLIO DE CASTILHOS,745,SALA 204,CENTRO,Lajeado,RS,95900000.0,5.0,137143444.0,,admsc@uniodontovtrp.com.br,DITMAR ARY KUHN,PRESIDENTE,5.0,,,,2025-10-20 17:16:59.558180
406295,3264151000145,UNIODONTO VALE DO SINOS COOPERATIVA ODONTOLÓGICA LTDA,UNIODONTO VALE DO SINOS,Cooperativa Odontológica,RUA 1º DE MARÇO,217,,CENTRO,São Leopoldo,RS,93010210.0,51,35913405,35897988,uniodontosinos@terra.com.br,LUIZ FRANCISCO MONTEIRO FLORES,VICE-PRESIDENTE,5.0,,,Alternat. à Liquidação - Deliberação de Diretoria Colegiada,2025-10-20 17:16:59.558180
401617,94989894000138,UNIODONTO CACHOEIRA DO SUL - COOP DE TRAB ODONTOLÓGICO LTDA.,UNIODONTO CACHOEIRA DO SUL,Cooperativa Odontológica,RUA SETE DE SETEMBRO,1014,SALA 14,CENTRO,Cachoeira do Sul,RS,96708010.0,51,37234782,37234782,ze@officcio.com.br,LUCIANO HUBNER DA SILVA,PRESIDENTE,,,,Pedido de cancelamento,2025-10-20 17:16:59.558180
366439,88938089000182,UNIODONTO PORTO ALEGRE COOPERATIVA ODONTOLOGICA LTDA,UNIODONTO PORTO ALEGRE COOPERATIVA ODONTOLOGICA LTDA,Cooperativa Odontológica,AV. INDEPENDÊNCIA,914,,INDEPENDÊNCIA,Porto Alegre,RS,90035072.0,51.0,33024000.0,33024077.0,regulacao@uniodontopoa.com.br,JULIO CESAR CORDOVA MACIEL,DIRETOR PRESIDENTE,4.0,,,,2025-10-20 17:16:59.558180
305421,72120124000111,UNIODONTO RS FEDERACAO DAS UNIODONTOS DO RGS LTDA,UNIODONTO/RS,Cooperativa Odontológica,RUA QUINTINO BANDEIRA,64,1º ANDAR - EDIF. SAMPAIO,SÃO GERALDO,Porto Alegre,RS,90220050.0,51.0,32257671.0,32868554.0,uniodontors@uniodonto-rs.com.br,IRNO AUGUSTO PRETTO,PRESIDENTE,3.0,,,,2025-10-20 17:16:59.558180
367966,2662309000172,UNIODONTO RIO GRANDE-LITORAL COOPERATIVA ODONTOLOGICA LTDA,,Cooperativa Odontológica,RUA LUIZ LOREA,263,,CENTRO,Rio Grande,RS,96200350.0,53.0,32321563.0,,uniodonto@uniodontoriogrande.com.br,DANIELI DUVAL PINTO DEVILLA,SUPERINTENDENTE,6.0,,,,2025-10-20 17:16:59.558180
344249,183997000162,UNIODONTO SERRA RS SOCIEDADE COOP. DE TRABALHO ODONTOLÓGICO,UNIODONTO SERRA RS,Cooperativa Odontológica,RUA PINHEIRO MACHADO,2569,62,SÃO PELEGRINO,Caxias do Sul,RS,95020172.0,54,223.5685,2148185,uniodonto.serra@terra.com.br,ROBERTO LOZANO DOS SANTOS,PRESIDENTE,6.0,,,Pedido de cancelamento,2025-10-20 17:16:59.558180
331210,87399572000173,UNIODONTO PASSO FUNDO COOPERATIVA DE TRABALHO ODONTOLÓGICO,UNIODONTO PASSO FUNDO,Cooperativa Odontológica,RUA INDEPENDENCIA,446,3º ANDAR,CENTRO,Passo Fundo,RS,99010041.0,54,33134177,30454277,uniodonto@st.com.br,ROGERIO ADOLFO TESSER,VICE PRESIDENTE,5.0,,,Deliberação de Diretoria Colegiada,2025-10-20 17:16:59.558180
411698,88440078000178,UNIODONTO ERECHIM - COOPERATIVA DE TRABALHO ODONTOLÓGICO,UNIODONTO ERECHIM,Cooperativa Odontológica,AV XV DE NOVEMBRO,69,,CENTRO,Erechim,RS,99700000.0,54,33212165,543212165,uniodontoerechim@clicalpha.com.br,FERNANDO RICARDO DA SILVA COLLA,PRESIDENTE,6.0,,,Pedido de cancelamento,2025-10-20 17:16:59.558180
362387,87593539000180,COOP. TRABALHO ODONTOLÓGICO UNIODONTO SANTA MARIA,UNIODONTO SANTA MARIA,Cooperativa Odontológica,CALÇADÃO SALVADOR ISAIAS,1259,SALA 1101,CENTRO,Santa Maria,RS,97015001.0,55,32222848,32222848,uniodontosm@terra.com.br,ANA MARISE SILVA DA SILVEIRA,PRESIDENTE,6.0,,,Pedido de cancelamento,2025-10-20 17:16:59.558180
315770,2510461000130,UNIODONTO DE CRUZ ALTA- COOPERATIVA ODONTOLÓGICA LTDA,UNIODONTO DE CRUZ ALTA,Cooperativa Odontológica,GENERAL CAMARA,1173,SOBRE LOJA,CENTRO,Cruz Alta,RS,98005112.0,55,33227277,33242925,uniodont@comnet.com.br,OSVALDO CAINO TEIXEIRA,PRESIDENTE,5.0,,,Pedido de cancelamento,2025-10-20 17:16:59.558180
410951,3585454000160,COOPERATIVA ODONTOLOGICA LTDA.,UNIODONTO MISSOES,Cooperativa Odontológica,RUA MARECHAL FLORIANO,1530,SOBRE LOJA,CENTRO,Santo Ângelo,RS,98801650.0,55,33128102,33128102,uniodontomissoes@via-rs.net,ROBERTO DOS SANTOS HOCHHEIM,DIRETORIA ADMINISTRATIVA,5.0,,,Pedido de cancelamento,2025-10-20 17:16:59.558180
341894,119565000192,UNIODONTO FRONTEIRA OESTE/RS COOPERATIVA ODONTOLÓGICA LTDA.,UNIODONTO FRONTEIRA OESTE/RS,Cooperativa Odontológica,AV. 24 DE MAIO,1091,,CENTRO,Sant'Ana do Livramento,RS,97573450.0,55.0,32423833.0,,adm@uniodontofronteiraoeste.com.br,LUIZ FERNANDO MENDONÇA BIDART,PRESIDENTE,5.0,,,,2025-10-20 17:16:59.558180
30200,1275393000109,UNIODONTO BRASILIA COOPERATIVA DE TRABALHO ODONTOLOGICO LTDA.,UNIODONTO BRASÍLIA,Cooperativa Odontológica,SRTUS,701,CONJ. D Nº 280 BLOCO A  SALA 732,ASA SUL,Brasília,DF,73340907.0,61,2233322,2233322,uniodbsb@tba.com.br,,,,,,Descumprimento da Circular SUSEP no. 77/1999,2025-10-20 17:16:59.558180
328171,1977905000189,COOPERATIVA DE TRABALHO ODONTOLOGICO DE ANAPOLIS,UNIODONTO DE ANAPOLIS,Cooperativa Odontológica,RUA BARÃO DE COTEGIPE,53,SALA 206,CENTRO,Anápolis,GO,75025010.0,62,3210556,3210556,rocsc@zaz.com.br,WERINGTON BORGES ARANTES,VICE PRESIDENTE,,,,Descumprimento da RN n.º 100/2005,2025-10-20 17:16:59.558180
358436,891689000191,UNIODONTO GOIANIA COOPERATIVA DE CIRURGIÕES DENTISTAS,UNIODONTO GOIANIA,Cooperativa Odontológica,RUA T-27,1115,"Quadra 65, Lote 4",SETOR BUENO,Goiânia,GO,74215030.0,62.0,32549100.0,32549101.0,uniodonto@uniodontogoiania.com.br,FÁBIO ARAÚJO GONÇALVES PRUDENTE,REPRESENTANTE,5.0,,,,2025-10-20 17:16:59.558180
414191,3702553000184,UNIODONTO DE CALDAS NOVAS SISTEMA NACIONAL DE COOPERATIVAS ODONT,UNIODONTO-CALDAS NOVAS,Cooperativa Odontológica,RUA DR. CIRO PALMERSTON,286,,CENTRO,Caldas Novas,GO,75690000.0,64,4537044,4537796,dentista@ih.com.br,MÁRCIA DURAN DE PAULA,DIRETORA PRESIDENTE,,,,Pedido de cancelamento,2025-10-20 17:16:59.558180
337137,1655691000124,COOPERATIVA DE TRABALHO ODONTOLOGICO DE CATALÃO LTDA,UNIODONTO CATALÃO,Cooperativa Odontológica,AV FARID MIGUEL SAFATLE,45,,CENTRO,Catalão,GO,75701040.0,64,34425125,34114858,r3advcatalao@hotmail.com,MARIA CRISTINA DE PAULA SOUSA,PRESIDENTE,6.0,,,Descumprimento da RN n.º 100/2005,2025-10-20 17:16:59.558180
319236,1483006000120,UNIODONTO DE JATAÍ COOPERATIVA ODONTOLOGICA,UNIODONTO DE JATAI,Cooperativa Odontológica,AV. DORIVAL DE CARVALHO,1187,SALA 102,CENTRO,Jataí,GO,75800014.0,64,36315151,36315151,uniodontojatai@hotmail.com,MOACYR VIEIRA SILVA FILHO,DIRETOR PRESIDENTE,6.0,,,Pedido de cancelamento,2025-10-20 17:16:59.558180
358339,37256591000172,UNIODONTO DO SUL GOIANO COOPERATIVA ODONTOLOGICA,UNIODONTO DO SUL GOIANO,Cooperativa Odontológica,RUA RUI DE ALMEIDA,519,,CENTRO,Itumbiara,GO,75503090.0,64.0,34317146.0,,uniodontosulgo@yahoo.com.br,JOAO BATISTA PEREIRA MACHADO,DIRETOR PRESIDENTE,5.0,,,,2025-10-20 17:16:59.558180
314871,2033677000151,UNIODONTO SUDOESTE GOIANO - COOPERATIVA DE TRABALHO ODONTOLOGICO,,Cooperativa Odontológica,RUA NIVALDO RIBEIRO,5,,CENTRO,Rio Verde,GO,75901120.0,64.0,36216063.0,,gerencia@uniodontosudoeste.com.br,FERNANDO FERREIRA DE ALMEIDA,PRESIDENTE,5.0,,,,2025-10-20 17:16:59.558180
343404,37496767000163,UNIODONTO DE MATO GROSSO COOP TRAB ODONTOLOGICO LTDA,UNIODONTO MATO GROSSO,Cooperativa Odontológica,AV. GENERAL MELLO,448,,DOM AQUINO,Cuiabá,MT,78015300.0,65.0,36176500.0,36176523.0,adm@uniodontomt.com.br,ERNESTO FARIA DE FIGUEIREDO JUNIOR,DIRETOR PRESIDENTE,3.0,,,,2025-10-20 17:16:59.558180
347183,3511888000115,UNIODONTO DE CAMPO GRANDE SIST. NAC. COOP. ODONT.,UNIODONTO MATO GROSSO DO SUL,Cooperativa Odontológica,RUA ANTONIO MARIA COELHO,1463,,CENTRO,Campo Grande,MS,79002221.0,67.0,30298040.0,30298040.0,gerencia@uniodontoms.com.br,FERNANDO JAIME CAVALLI,PRESIDENTE,3.0,,,,2025-10-20 17:16:59.558180
313807,199703000190,UNIODONTO DOURADOS - COOPERATIVA ODONTOLÓGICA,,Cooperativa Odontológica,RUA CIRO MELLO,2658,,JARDIM CENTRAL,Dourados,MS,79805031.0,67.0,34223577.0,,uniodonto@dourados.com.br,EDSON HIROSHI MURAKI,PRESIDENTE,5.0,,,,2025-10-20 17:16:59.558180
403997,2948490000188,UNIODONTO DE RIO BRANCO ACRE COOPERATIVA ODONTOLÓGICA LTDA.,UNIODONTO - AC,Cooperativa Odontológica,AV. CEARÁ,2219,,DOM GIOCONDO,Rio Branco,AC,69900303.0,68.0,21026500.0,,uniodonto@uniodontoacre.com.br,EDIANA DE FÁTIMA MELO MAGELA,PRESIDENTE,6.0,,,,2025-10-20 17:16:59.558180
336025,2742094000108,UNIODONTO DE RONDONIA COOPERATIVA LTDA.,UNIODONTO DE RONDÔNIA,Cooperativa Odontológica,RUA JAMARY,1783,,PEDRINHAS,Porto Velho,RO,76801492.0,69.0,32233320.0,32233315.0,gerencia@uniodontorondonia.com.br,DIMAS RIBEIRO DA FONSECA JUNIOR,PRESIDENTE,6.0,,,,2025-10-20 17:16:59.558180
402010,491998000174,COOPERATIVA ODONTOLÓGICA REGIÃO SUL DA BAHIA - UNIODONTO,UNIODONTO ITABUNA,Cooperativa Odontológica,RUA MARIÁ FERREIRA,245,1º ANDAR,CENTRO,Itabuna,BA,45600120.0,7.0,336134760.0,36134760.0,uniodontoitb@gmail.com,MARIO AUGUSTO DIAS BRUM,PRESIDENTE,5.0,,,,2025-10-20 17:16:59.558180
310107,13416391000171,UNIODONTO DE SALVADOR - COOPERATIVA DE TRABALHO ODONTOLÓGICO LTDA.,UNIODONTO SALVADOR,Cooperativa Odontológica,RUA FRANCISCO GONÇALVES,1,SALA 205/206,COMERCIO,Salvador,BA,40015090.0,71.0,40099696.0,,adm@uniodontosalvador.com.br,OTAILDO CONCEIÇÃO DE OLIVEIRA,PRESIDENTE,6.0,,,,2025-10-20 17:16:59.558180
383929,629608000180,UNIODONTO BAHIA SUL - COOPERATIVA ODONTOLOGICA DE ILHEUS RESPONSABILIDADE LTDA,UNIODONTO BAHIA SUL,Cooperativa Odontológica,AVENIDA SOARES LOPES,386,,CENTRO,Ilhéus,BA,45653005.0,73.0,36347050.0,36347050.0,gerenciaadm@uniodontobahiasul.com.br,LUCIANO MOREIRA TAVARES,PRESIDENTE,5.0,,,,2025-10-20 17:16:59.558180
