REG_ANS,CNPJ,RAZAO_SOCIAL,NOME_FANTASIA,MODALIDADE,LOGRADOURO,NUMERO,COMPLEMENTO,BAIRRO,CIDADE,UF,CEP,DDD,TELEFONE,FAX,EMAIL,REPRESENTANTE,CARGO_REPRESENTANTE,REGIAO_DE_COMERCIALIZACAO,DATA_REGISTRO_ANS,DATA_DESCREDENCIAMENTO,MOTIVO_DO_DESCREDENCIAMENTO,DATA_PROCESSAMENTO
402109,2772726000178,UNIODONTO PAULO AFONSO COOPERATIVA DE TRABALHO ODONTOLÓGICO LTDA.,UNIODONTO PAULO AFONSO,Cooperativa Odontológica,AV. GETULIO VARGAS,421,"SALA 206, 2 ANDAR",CENTRO,Paulo Afonso,BA,48601260.0,75.0,32810003.0,32810003.0,uniodonto@uniodontopauloafonso.com.br,CYNARA MAIA DE OLIVEIRA,DIRETOR PRESIDENTE,5.0,,,,2025-10-20 17:16:59.558180
349283,32844169000114,UNIODONTO DE ARACAJU COOP DE TRABALHO ODONTOLOGICO,UNIODONTO DE ARACAJU COOPERATIVA DE TRABALHO ODONTOLOGICO,Cooperativa Odontológica,RUA JOVENTINA ALVES,265,,SALGADO FILHO,Aracaju,SE,49020330.0,79.0,40095454.0,40095450.0,uniodont@infonet.com.br,LIOMAR MARIA DE OLIVEIRA QUARANTA,PRESIDENTE,6.0,,,,2025-10-20 17:16:59.558180
321125,24243925000121,UNIODONTO MACEIÓ COOPERATIVA ODONTOLÓGICA,UNIODONTO MACEIO,Cooperativa Odontológica,AV. SANTA RITA DE CASSIA,278,,FAROL,Maceió,AL,57051600.0,8.0,221233300.0,221233300.0,uniodonto@uniodontomaceio.com.br,JOSE ZENOU COSTA FILHO,PRESIDENTE,3.0,,,,2025-10-20 17:16:59.558180
32642,1141489000184,UNIODONTO COOP ODONTOLOGICA DE C E R AGREST DO EST PE,UNIODONTO CARUARU,Cooperativa Odontológica,RUA VIDAL DE NEGREIROS,198,,CENTRO,Caruaru,PE,55006431.0,81,7216769,7216769,uniodontocaruaru@netstage.com.br,,,,,,Descumprimento da Circular SUSEP no. 77/1999,2025-10-20 17:16:59.558180
305740,24125122000172,UNIODONTO DE RECIFE - COOPERATIVA ODONTOLÓGICA,UNIODONTO DE RECIFE - COOPERATIVA ODONTOLÓGICA,Cooperativa Odontológica,RUA MONTEVIDÉU,172,SALA 902 - EMPRESARIAL DESEMBARGADOR  PE,BOA VISTA,Recife,PE,50050250.0,81.0,33661888.0,33661875.0,anayramaltez@uniodontorecife.com.br,ANAYRA SILVANA DA CUNHA MALTEZ,DIRETORA PRESIDENTE,5.0,,,,2025-10-20 17:16:59.558180
416177,40639163000133,"UNIODONTO-NORDESTE, CENTRAL REGIONAL DAS COOP. ODONT. DO NORD. DO BRASIL",UNIODONTO-NORDESTE,Cooperativa Odontológica,AVENIDA SANTA RITA DE CÁSSIA,278,SALA 606 - EMPRESARIAL CENTENÁRIO OFFICE,FAROL,Maceió,AL,57051600.0,82,21233300,21233300,federacao@uniodontonordeste.com.br,EUGENIO CARLOS ARAUJO,PRESIDENTE,2.0,,,Pedido de cancelamento,2025-10-20 17:16:59.558180
403512,2988689000130,UNIODONTO ARAPIRACA COOPERATIVA DE TRABALHO ODONTOLÓGICO LTDA,UNIODONTO ARAPIRACA,Cooperativa Odontológica,RUA PADRE JEFERSON DE CARVALHO,43,,ALTO DO CRUZEIRO,Arapiraca,AL,57312480.0,82.0,35222383.0,35223429.0,uniodonto@uniodontoarapiraca.com.br,CLAUDIA VALERIA LIRA BARBOSA,REPRESENTANTE LEGAL,5.0,,,,2025-10-20 17:16:59.558180
311928,11986304000196,UNIODONTO DE CAMPINA GRANDE - COOPERATIVA DE TRABALHO ODONTO,UNIODONTO DE CAMPINA GRANDE,Cooperativa Odontológica,RUA AFONSO CAMPOS,121,,CENTRO,Campina Grande,PB,58100600.0,83,33434470,33416188,uniodontocg@veloxmail.com.br,MOEMA ARARUNA DE OLIVEIRA,PRESIDENTE,5.0,,,Pedido de cancelamento,2025-10-20 17:16:59.558180
363332,2874104000150,COOPERATIVA ODONTOLOGICA DO SERTÃO PARAIBANO LTDA,UNIODONTO,Cooperativa Odontológica,RUA CORONEL PEBA,497,1º AND,CENTRO,Cajazeiras,PB,58900000.0,83,5311640,5311640,eugenia@rix.com.br,EUGENIA MARIA ROLIM MEIRA,PRESIDENTE,,,,Pedido de cancelamento,2025-10-20 17:16:59.558180
361569,12923462000160,UNIODONTO DE JOÃO PESSOA COOPERATIVA ODONTOLÓGICA,UNIODONTO JOAO PESSOA,Cooperativa Odontológica,AV. DUARTE DA SILVEIRA,541,,CENTRO,João Pessoa,PB,58013280.0,83.0,21075858.0,,uniodontojp@uniodontojp.com.br,TERTULIANO BRITO NETO,DIRETOR PRESIDENTE,5.0,,,,2025-10-20 17:16:59.558180
345318,8237810000178,UNIODONTO/RN - COOPERATIVA ODONTOLOGICA DO RIO GRANDE DO NORTE,UNIODONTO/RN,Cooperativa Odontológica,RUA AÇU,665,,TIROL,Natal,RN,59020110.0,84.0,40094664.0,40094665.0,gerencia@uniodontorn.com.br,EUGÊNIO CARLOS ARAÚJO,PRESIDENTE,5.0,,,,2025-10-20 17:16:59.558180
343919,1751280000132,UNIODONTO COOPERATIVA ODONTOLÓGICA DO SERIDÓ LTDA,UNIODONTO DO SERIDÓ,Cooperativa Odontológica,RUA SENADOR JOSÉ BERNARDO,663,,CENTRO,Caicó,RN,59300000.0,84.0,34211477.0,844173799.0,uniodontoserido@terra.com.br,MARCO POLO AYRES DO RÊGO,PRESIDENTE,6.0,,,,2025-10-20 17:16:59.558180
303291,2313780000155,UNIODONTO MOSSORÓ - COOPERATIVA DOS CIRURGIÕES DENTISTAS DE MOSSORÓ E REGIÃO OESTE,UNIODONTO MOSSORÓ,Cooperativa Odontológica,AV DIOCESANA,266,,NOVA BETANIA,Mossoró,RN,59603200.0,84.0,33161115.0,33162990.0,gerencia@uniodontomossoro.com.br,FRANCISCO AVES DE OLIVEIRA,PRESIDENTE,6.0,,,,2025-10-20 17:16:59.558180
335258,23725062000166,UNIODONTO DE FORTALEZA COOPERATIVA DE TRABALHO ODONTOLOGICO LTDA,UNIODONTO DE FORTALEZA,Cooperativa Odontológica,RUA  COSTA BARROS,915,,CENTRO,Fortaleza,CE,60160280.0,85.0,40095442.0,40095442.0,contabil@uniodonto-ce.com.br,MARLIO XIMENES CARLOS,DIRETOR PRESIDENTE,3.0,,,,2025-10-20 17:16:59.558180
317462,1008349000132,UNIODONTO DO PIAUI - COOP. DE TRAB. ODONTOLOGICO,UNIODONTO PIAUI,Cooperativa Odontológica,RUA LIZANDRO NOGUEIRA,1618,SALA 02,CENTRO,Teresina,PI,64000200.0,86,2233133,32210055,raulino@ctcc.com.br,EDGAR LEITE FILHO,PRESIDENTE,6.0,,,Deliberação de Diretoria Colegiada,2025-10-20 17:16:59.558180
342335,1501597000110,COOPERATIVA ODONTOLÓGICA DE GARANHUNS E AGRESTE MERIDIONAL.,UNIODONTO GARANHUNS,Cooperativa Odontológica,R DR JOSE MARIANO,193,,SAO JOSE,Garanhuns,PE,55293335.0,87.0,37621760.0,37621760.0,uniodonto@uniodontogaranhuns.coop.br,DANIEL VALENCA ARRUDA VIEIRA,PRESIDENTE,5.0,,,,2025-10-20 17:16:59.558180
368555,15308521000188,UNIODONTO BELÉM - COOPERATIVA DE ASSISTÊNCIA À SAÚDE ODONTOLÓGICA,UNIODONTO,Cooperativa Odontológica,AV GENTIL BITTENCOURT,1212,,NAZARÉ,Belém,PA,66040000.0,91.0,32024140.0,,uniodopa@uniodontobelem.com.br,ARIOSTO MARIA CHAVES DIAS,PRESIDENTE,5.0,,,,2025-10-20 17:16:59.558180
311391,23031479000129,UNIODONTO DE MANAUS - COOPERATIVA ODONTOLÓGICA LTDA.,UNIODONTO MANAUS,Cooperativa Odontológica,RUA LEONARDO MALCHER,598,,CENTRO,Manaus,AM,69010170.0,92.0,21260600.0,,atendimento@uniodontomao.com.br,MICHELE PASCHOALOTTI LEMOS,DIRETORA EXECUTIVA,6.0,,,,2025-10-20 17:16:59.558180
418242,1750093000134,COOPERATIVA DE SAÚDE ODONTOLÓGICA - UNIODONTO RORAIMA,UNIODONTO DE RORAIMA,Cooperativa Odontológica,AVENIDA CAPITÃO JULIO BEZERRA,952,,SÃO FRANCISCO,Boa Vista,RR,69305025.0,95.0,36234900.0,36234900.0,diretoria@uniodontorr.com.br,CARLOS ALEXANDRE PRADO HORTA,PRESIDENTE,6.0,,,,2025-10-20 17:16:59.558180
365785,2254846000183,COOPERATIVA ODONTOLÓGICA DO ESTADO DO AMAPÁ,UNIODONTO AMAPÁ,Cooperativa Odontológica,RUA MARCELO CÂNDIA,925,,SANTA RITA,Macapá,AP,68901341.0,96.0,91515691.0,,uniodontoap@uniodontoap.com.br,CLAUDIO VALENTE CALANDRINI DE AZEVEDO,DIRETOR PRESIDENTE,6.0,,,,2025-10-20 17:16:59.558180
369616,41492976000106,UNIODONTO DE SÃO LUIS - COOP. DOS C. D. DO ESTADO DO MARANHÃ,UNIODONTO DE SÃO LUIS,Cooperativa Odontológica,RUA DOMINGOS PERDIGÃO,80,,APICUM,São Luís,MA,65025320.0,98,32135812,32135812,uniodonto@elo.com.br,OLINTO SANTOS CARDOSO,PRESIDENTE,6.0,,,Alternat. à Liquidação - Deliberação de Diretoria Colegiada,2025-10-20 17:16:59.558180
